[
  {
    "cycle_id": "20260917-123218-6083d6",
    "timestamp": "2026-09-17T11:32:18.864793+00:00",
    "category": "code",
    "metric": "latency",
    "fingerprint": "unknown",
    "result": "fail",
    "hypothesis": {},
    "score": null,
    "effective_bar": null,
    "candidate_sha": null,
    "report_path": "reports/20260917-123218-6083d6.md"
  },
  {
    "cycle_id": "20260917-142021-509808",
    "timestamp": "2026-09-17T13:20:21.699640+00:00",
    "category": "code",
    "metric": "latency",
    "fingerprint": "unknown",
    "result": "fail",
    "hypothesis": {},
    "score": null,
    "effective_bar": null,
    "candidate_sha": null,
    "report_path": "reports/20260917-142021-509808.md"
  },
  {
    "cycle_id": "20260917-152022-443eaa",
    "timestamp": "2026-09-17T14:20:22.372428+00:00",
    "category": "code",
    "metric": "latency",
    "fingerprint": "unknown",
    "result": "fail",
    "hypothesis": {},
    "score": null,
    "effective_bar": null,
    "candidate_sha": null,
    "report_path": "reports/20260917-152022-443eaa.md"
  },
  {
    "cycle_id": "20260917-162022-710699",
    "timestamp": "2026-09-17T15:20:22.763408+00:00",
    "category": "code",
    "metric": "latency",
    "fingerprint": "unknown",
    "result": "fail",
    "hypothesis": {},
    "score": null,
    "effective_bar": null,
    "candidate_sha": null,
    "report_path": "reports/20260917-162022-710699.md"
  },
  {
    "cycle_id": "20260917-172023-bec42c",
    "timestamp": "2026-09-17T16:20:23.264524+00:00",
    "category": "code",
    "metric": "latency",
    "fingerprint": "unknown",
    "result": "fail",
    "hypothesis": {},
    "score": null,
    "effective_bar": null,
    "candidate_sha": null,
    "report_path": "reports/20260917-172023-bec42c.md"
  },
  {
    "cycle_id": "20260917-182023-607739",
    "timestamp": "2026-09-17T17:20:23.753976+00:00",
    "category": "code",
    "metric": "latency",
    "fingerprint": "unknown",
    "result": "fail",
    "hypothesis": {},
    "score": null,
    "effective_bar": null,
    "candidate_sha": null,
    "report_path": "reports/20260917-182023-607739.md"
  },
  {
    "cycle_id": "20260917-204724-c39f46",
    "timestamp": "2026-09-17T19:47:24.166257+00:00",
    "category": "code",
    "metric": "latency",
    "fingerprint": "unknown",
    "result": "fail",
    "hypothesis": {},
    "score": null,
    "effective_bar": null,
    "candidate_sha": null,
    "report_path": "reports/20260917-204724-c39f46.md"
  },
  {
    "cycle_id": "20260918-024339-c04451",
    "timestamp": "2026-09-18T01:43:39.763332+00:00",
    "category": "code",
    "metric": "latency",
    "fingerprint": "unknown",
    "result": "fail",
    "hypothesis": {},
    "score": null,
    "effective_bar": null,
    "candidate_sha": null,
    "report_path": "reports/20260918-024339-c04451.md"
  },
  {
    "cycle_id": "20260918-043129-479749",
    "timestamp": "2026-09-18T03:31:29.701169+00:00",
    "category": "code",
    "metric": "latency",
    "fingerprint": "unknown",
    "result": "fail",
    "hypothesis": {},
    "score": null,
    "effective_bar": null,
    "candidate_sha": null,
    "report_path": "reports/20260918-043129-479749.md"
  },
  {
    "cycle_id": "20260918-075111-899165",
    "timestamp": "2026-09-18T06:51:11.966807+00:00",
    "category": "code",
    "metric": "latency",
    "fingerprint": "unknown",
    "result": "fail",
    "hypothesis": {},
    "score": null,
    "effective_bar": null,
    "candidate_sha": null,
    "report_path": "reports/20260918-075111-899165.md"
  },
  {
    "cycle_id": "20260918-083205-a3bab8",
    "timestamp": "2026-09-18T07:43:50.467661+00:00",
    "category": "model",
    "metric": "latency",
    "fingerprint": "dd87dc7534a9ab5469e20eefa09ee69ed3b61f386eb926a0d5849eb9d7527c76",
    "result": "pass",
    "hypothesis": {
      "category": "model",
      "tier": "local",
      "candidate_model": "llama3",
      "candidate_provider": "ollama-local",
      "metric": "latency",
      "threshold": 0.05,
      "guard": {
        "metric": "success_rate",
        "max_regression": 0.0
      }
    },
    "score": 0.231538092615698,
    "effective_bar": 0.1,
    "candidate_sha": null,
    "report_path": "reports/20260918-083205-a3bab8.md"
  },
  {
    "cycle_id": "20260918-095930-304c0a",
    "timestamp": "2026-09-18T09:07:31.725195+00:00",
    "category": "model",
    "metric": "latency",
    "fingerprint": "1a4c9bcc3c97d99dd196840d19644ca94a41bc2ba1ac8ca7b794c9a37be2bcc0",
    "result": "fail",
    "hypothesis": {
      "category": "model",
      "tier": "local",
      "candidate_model": "phi3",
      "candidate_provider": "ollama-local",
      "metric": "latency",
      "threshold": 0.07,
      "guard": {
        "metric": "success_rate",
        "max_regression": 0.0
      }
    },
    "score": -0.00046997671147203015,
    "effective_bar": 0.1,
    "candidate_sha": null,
    "report_path": "reports/20260918-095930-304c0a.md"
  },
  {
    "cycle_id": "20260918-110733-253a1b",
    "timestamp": "2026-09-18T10:12:56.904130+00:00",
    "category": "model",
    "metric": "latency",
    "fingerprint": "bd8eaa51175e3644bf492ecc5ae5477ff9a073f675feab5aeee211634bb9ef03",
    "result": "fail",
    "hypothesis": {
      "category": "model",
      "tier": "mid",
      "candidate_model": "llama3",
      "candidate_provider": "groq",
      "metric": "latency",
      "threshold": 0.06,
      "guard": {
        "metric": "success_rate",
        "max_regression": 0.0
      }
    },
    "score": -0.0437355167244641,
    "effective_bar": 0.1,
    "candidate_sha": null,
    "report_path": "reports/20260918-110733-253a1b.md"
  },
  {
    "cycle_id": "20260918-135459-aca9a2",
    "timestamp": "2026-09-18T13:00:57.362018+00:00",
    "category": "model",
    "metric": "latency",
    "fingerprint": "d61447583c2364d4a6fc102f9070b6b1c9c808ee7a816aa32019b18938cc6e70",
    "result": "fail",
    "hypothesis": {
      "category": "model",
      "tier": "mid",
      "candidate_model": "mixtral-8x7b",
      "candidate_provider": "groq",
      "metric": "latency",
      "threshold": 0.05,
      "guard": {
        "metric": "success_rate",
        "max_regression": 0.0
      }
    },
    "score": -0.027568635155628806,
    "effective_bar": 0.1,
    "candidate_sha": null,
    "report_path": "reports/20260918-135459-aca9a2.md"
  },
  {
    "cycle_id": "20260918-155852-9151d8",
    "timestamp": "2026-09-18T15:02:43.849845+00:00",
    "category": "model",
    "metric": "latency",
    "fingerprint": "b900facf01bcaf7f4ba915c97a545d754ad2042ce3ec2a16f521cb9f05f037e7",
    "result": "fail",
    "hypothesis": {
      "category": "model",
      "tier": "mid",
      "candidate_model": "llama3-8b",
      "candidate_provider": "groq",
      "metric": "latency",
      "threshold": 0.04,
      "guard": {
        "metric": "success_rate",
        "max_regression": 0.0
      }
    },
    "score": -0.02886498692787782,
    "effective_bar": 0.1,
    "candidate_sha": null,
    "report_path": "reports/20260918-155852-9151d8.md"
  },
  {
    "cycle_id": "20260918-173140-61576f",
    "timestamp": "2026-09-18T16:35:34.409085+00:00",
    "category": "code",
    "metric": "latency",
    "fingerprint": "unknown",
    "result": "fail",
    "hypothesis": {
      "category": "code",
      "metric": "latency",
      "threshold": 0.05,
      "guard": {
        "metric": "success_rate",
        "max_regression": 0.0
      }
    },
    "score": null,
    "effective_bar": null,
    "candidate_sha": null,
    "report_path": "reports/20260918-173140-61576f.md"
  },
  {
    "cycle_id": "20260918-195234-493840",
    "timestamp": "2026-09-18T18:59:26.186982+00:00",
    "category": "code",
    "metric": "latency",
    "fingerprint": "unknown",
    "result": "fail",
    "hypothesis": {},
    "score": null,
    "effective_bar": null,
    "candidate_sha": null,
    "report_path": "reports/20260918-195234-493840.md"
  },
  {
    "cycle_id": "20260919-005312-e509fd",
    "timestamp": "2026-09-19T01:44:36.485881+00:00",
    "category": "code",
    "metric": "latency",
    "fingerprint": "unknown",
    "result": "fail",
    "hypothesis": {
      "category": "code",
      "metric": "latency",
      "threshold": 0.05,
      "guard": {
        "metric": "success_rate",
        "max_regression": 0.0
      }
    },
    "score": null,
    "effective_bar": null,
    "candidate_sha": null,
    "report_path": "reports/20260919-005312-e509fd.md"
  },
  {
    "cycle_id": "20260919-043520-55feff",
    "timestamp": "2026-09-19T06:01:58.831031+00:00",
    "category": "code",
    "metric": "latency",
    "fingerprint": "unknown",
    "result": "fail",
    "hypothesis": {},
    "score": null,
    "effective_bar": null,
    "candidate_sha": null,
    "report_path": "reports/20260919-043520-55feff.md"
  },
  {
    "cycle_id": "20260919-131017-2c71bc",
    "timestamp": "2026-09-19T17:24:15.001631+00:00",
    "category": "n/a",
    "metric": "n/a",
    "fingerprint": "unknown",
    "result": "fail",
    "hypothesis": {},
    "score": null,
    "effective_bar": null,
    "candidate_sha": null,
    "report_path": "reports/20260919-131017-2c71bc.md"
  },
  {
    "cycle_id": "20260919-194033-bb390f",
    "timestamp": "2026-09-19T18:43:16.616798+00:00",
    "category": "n/a",
    "metric": "n/a",
    "fingerprint": "unknown",
    "result": "fail",
    "hypothesis": {},
    "score": null,
    "effective_bar": null,
    "candidate_sha": null,
    "report_path": "reports/20260919-194033-bb390f.md"
  },
  {
    "cycle_id": "20260919-221453-d67303",
    "timestamp": "2026-09-19T21:28:14.579248+00:00",
    "category": "n/a",
    "metric": "n/a",
    "fingerprint": "unknown",
    "result": "fail",
    "hypothesis": {},
    "score": null,
    "effective_bar": null,
    "candidate_sha": null,
    "report_path": "reports/20260919-221453-d67303.md"
  },
  {
    "cycle_id": "20260919-230101-248310",
    "timestamp": "2026-09-19T22:13:01.336493+00:00",
    "category": "code",